user_input,retrieved_contexts,response,reference,faithfulness,answer_relevancy,context_precision,context_recall
"específico, de livre escolha.","['específico, sendo 02 ( duas) da linha de pesquisa a que se vinculou e outras 02 (duas) de sua livre escolha; viii - o aluno regular, desde que com a concordância do seu orientador poderá cursar disciplina de aprofundamento específico – de outra linha de pesquisa –, em substituição a uma das 03 (três) disciplinas de formação geral', 'prof. dr. ................ – (instituição) - suplente p.s: esse documento pode ser gerado no sei e assinado digitalmente pelos membros da banca.', '. espera-se até mesmo que a coordenação e o colegiado do programa estimulem seus docentes a, de tempos em tempos, oferecerem tais disciplinas, evitando-se que levem anos e anos no programa ministrando sempre a mesma disciplina.', 'prezados senhores: solicitamos a vossa senhoria, repassar as pós-graduações as informações abaixo, para confecção de ficha catalográfica. solicitação de ficha catalográfica a biblioteca as fichas são solicitadas pelo sistema: https://bicenficha.apps.uepg.br/login maiores esclarecimentos podem ligar –\xa03220-3383 ou enviar e-mail para\xa0processostecnicos@uepg.br que daremos as orientações. taxa de serviço,\xa0conforme resolução ca nº288 de 6 de agosto de 2012. catalogação na fonte/ficha catalográfica comunidade interna/uepg r$ 10,00 comunidade externa r$ 30,00 o valor deve ser pago por depósito bancário no banco caixa econômica federal – ag. 3186 – operação 003 c/c 118-5 em nome da fauepg. atenciosamente, eunice silva de novais diretora da biblioteca', '. o produto translacional deverá ser apresentado e descrito, com clara vinculação à dissertação. art. 7º. a introdução ampliada deverá conter entre 3 e 10 páginas, podendo conter subtópicos, incluindo o estado da arte, as justificativas e as hipóteses da pesquisa. art. 8º. os objetivos devem ser redigidos de forma direta e clara, contemplando o foco investigativo de cada artigo, sem necessidade de subdivisão entre objetivos gerais e específicos. art. 9º. o material e os métodos deverão apresentar informações suficientes para possibilitar a compreensão e a reprodutibilidade dos resultados, com ênfase na abordagem translacional. art. 10. a seção de artigos corresponderá aos resultados da dissertação. os artigos poderão estar em português, inglês ou espanhol, mas devem conter versão do resumo em português.', '. art. 55 das decisões do colegiado caberão recursos à cpg e destas ao conselho de ensino, pesquisa e extensão – cepe. art. 56 os casos não previstos nesse regulamento serão resolvidos pelo cepe, ouvido o colegiado do programa e a cpg.', '. reitoria da universidade estadual de ponta grossa. ponta grossa, 30 de novembro de 2020. miguel sanches neto, reitor. documento assinado eletronicamente por miguel sanches neto, reitor, em 01/12/2020, às 10:11, conforme art. 1º, iii, ""b"", da lei 11.419/2006. a autenticidade do documento pode ser conferida no site https://sei.uepg.br/autenticidade informando o código verificador 0363290 e o código crc 3a69741b. 20.000041134-8 0363290v2', '. art. 39 os discentes possuirão, desde o ingresso no programa, um projeto de', '. 20/2016). pontuação mínima a ser atingida no exame: 7 (sete) pontos ou equivalente. ii) aprovação em teste de suficiência, em inglês ou espanhol, realizado pelo departamento de estudos da linguagem da uepg por solicitação do programa. pontuação mínima a ser atingida no exame: 7 (sete) pontos ou equivalente. iii) declaração de aprovação em exame de suficiência em língua estrangeira expedida nos últimos 02 (dois) anos, por instituição de ensino superior devidamente reconhecida pelo mec ou entidade que aplique o exame por delegação destas instituições. pontuação mínima a ser atingida no exame: 7 (sete) pontos ou equivalente. iv) test of english as a foreign language (toefl) ibt. pontuação mínima a ser atingida no exame: 85 (oitenta e cinco) pontos. v) test of english as a foreign language (toefl) itp. pontuação mínima a ser atingida no exame: 500 (quinhentos) pontos. vi) international english language testing system (ielts). pontuação mínima a ser atingida no exame: 6 (seis) pontos. vii) test of english for academic purposes (teap). pontuação mínima a ser atingida no exame: 70 (setenta) pontos. viii) cambridge first certificate in english. nota mínima a ser atingida no exame: b. ix) cambridge certificate in advanced english. nota mínima a ser atingida no exame: c. x) cambridge esol skills for life. resultado a ser atingido no exame: “pass”', '. estado de direito e políticas públicas ementas: as origens do estado. o poder do estado. formação e justificação do estado: teoria das formas de estado. estado social e democrático de direito. estado de bem-estar social e reformas políticas. estado e ideologia. estado e poder. estado e sociedade. limitação do poder do estado. estado federativo e políticas públicas. estado federativo e descentralização de políticas públicas. as relações de poder entre os entes federativos. o autoritarismo no estado brasileiro e suas implicações no desenho das políticas públicas. estado na américa latina e suas transformações. práticas governamentais, práticas sociopolíticas e o papel do direito, entre os fundamentos normativos e as condições empíricas do estado democrático de direito, em meio às demandas e contingências complexas e plurais das sociedades contemporâneas. solução negociada de conflitos cíveis, criminais e de interesse da administração pública ementa: o campo jurídico entre o conflito e consenso, nos campos cível, penal e de interesse da administração pública. limites éticos e jurídicos à negociação. pragmatismo e justiça. meios extrajudiciais e judiciais de composição de litígios. sistemas autocompositivos (conciliação, mediação e negociação) e heterocompositivos (jurisdição e arbitragem). horizontes, limites e desafios para uma justiça “restaurativa”']","Desculpe, não tenho informações suficientes para responder a essa pergunta.",nan,1.0,0.0,0.0,0.0
Será que consigo aproveitamento numa disciplina que fiz no modelo remoto?,"['universidade estadual de ponta grossa anexo da resolução cepe no 2022.13 fl. 20 de 22 mp = de pós -graduação stricto sensu da uepg. cada disciplina aprovada pelo colegiado do programa deverá constar no histórico escolar do aluno como transferência, mantendo -se a avaliação obtida no curso externo e explicitando -se a equivalência de número de créditos a ela atribuída. parágrafo ú nico. a média ponderada – mp para o cálculo do rendimento acadêmico é a soma do produto do número de créditos cursados – ni pelos respectivos conceitos – ni, dividido pelo número de créditos realizados, expresso pela fórmula seguinte: ∑ni ni ∑ni onde: ni - número de créditos das disciplinas ni - conceito das disciplinas - valor 4 para disciplina de conceito a - valor 3 para disciplina de conceito b - valor 2 para disciplina de conceito c - valor 1 para disciplina de conceito d. art', '. a disciplina tomará como referencial básico obras de relevância fundamental para a teoria da justiça contemporânea, sobre o fundamento das quais empreenderá um retorno apropriativo às contribuições dos clássicos da história da filosofia do direito, com vistas à elaboração de um diagnóstico do presente, bem como à abertura de um horizonte experimental para a reflexão e a crítica visando encaminhamentos e alternativas de solução para as cruciais demandas sociais de acesso à justiça, de liberdade, igualdade, reconhecimento, respeito e equidade no tratamento em questões de classe e gênero, raça e etnia, opinião e expressão do pensamento, no enfrentamento dos impasses e dilemas do pensamento ético-jurídico de nossos dias. metodologia da pesquisa translacional no direito ementa: da metodologia de pesquisa das ciências sociais às especificidades do campo jurídico. métodos quantitativos e qualitativos. conhecimento dos fundamentos da pesquisa “pura” e “aplicada”, no campo jurídico, e sua possível superação pela perspectiva “translacional”. dos enfoques “clássicos” às abordagens metodológicas contemporâneas. instituições jurídicas como ambientes de pesquisa. da pesquisa dos resultados da produção jurídica à pesquisa sobre a própria construção do direito aplicado. ética da pesquisa. escrita acadêmica. o “quadrante de pasteur”', 'específico, sendo 02 ( duas) da linha de pesquisa a que se vinculou e outras 02 (duas) de sua livre escolha; viii - o aluno regular, desde que com a concordância do seu orientador poderá cursar disciplina de aprofundamento específico – de outra linha de pesquisa –, em substituição a uma das 03 (três) disciplinas de formação geral', '. essa situação poderá ocorrer quando se avalie que a transversalidade exigida do mestrando possa, nas circunstâncias do tema que pesquise e dependendo da natureza e cronograma das disciplinas event ualmente', '. 3º. até o mês de agosto de cada ano letivo o coordenador, em reunião do colegiado, relatará o interesse das instituições requerentes por vagas de fomento, bem como a anuência destes pedidos com os requisitos presentes nesta instrução normativa. com base neste relato o colegiado autorizará as vaga de fomento para cada instituição requerente, por ocasião do planejamento do processo seletivo. parágrafo ùnico - para que a vaga fomento seja aprovada pelo colegiado a instituição requerente deverá cumprir com os seguintes requisitos: a) resposta tempestiva sobre o interesse em ter vaga de fomento até a data estipulada no ofício de consulta à instituição enviado pela coordenação do mestrado; b) apresentação do anexo i da presente instrução normativa preenchido, com a indicação do (s) respectivo candidato; c) autorização para que a instituição seja campo de estágio de imersão técnica e institucional para os candidatos da vaga fomento e também para acadêmicos do mestrado profissional em direito; d) apresentação de contrapartida ao mestrado e ao professor orientador no interesse da realização do desenvolvimento do projeto de pesquisa tais como pagamento de publicações ou acesso a revista acadêmica da instituição,patrocínio de eventos acadêmicos, auxílio a participação em eventos ou cursos acadêmicos ou', '. a denominada “perspectiva translacional” refere-se a recente orientação de metodologia da pesquisa, que nasceu na área das ciências da saúde nas duas últimas três décadas e que, a partir dos últimos quinze anos, tem sido incentivada por agências de fomento à pesquisa mundo afora. trata-se de uma inovadora orientação que promove a articulação, em firme retroalimentação, de teoria e prática. como dizem os cientistas da área de saúde, com imagens e expressões próprias do campo da medicina, a pesquisa translacional busca ultrapassar a tradicional visão linear, unidirecional (“da bancada dos laboratórios para o leito do paciente”), em prol de um processo dinâmico, bidirecional de transferência de conhecimentos (“das bancadas acadêmicas para as clínicas e leitos dos pacientes e vice-versa”). destarte, aos futuros mestres do programa será dada a qualificação técnica, científica e metodológica - em viés ao mesmo tempo crítico-reflexivo e propositivo, inovador e reformador - para fazerem a diferença, em contextos técnicos profissionais de atuação das diversas carreiras jurídicas, como também se iniciarem na docência do ensino superior', 'desde que haja a aprovação do colegiado do programa; xv - cada orientador poderá ter até 02 (dois) orientandos no primeiro ciclo avaliativo do programa, número que nos ciclos posteriores, ou por razões excepcionais, justificadas pelo colegiado do programa, poderá chegar até 04 (quatro) orientandos simultaneamente', 'prezados senhores: solicitamos a vossa senhoria, repassar as pós-graduações as informações abaixo, para confecção de ficha catalográfica. solicitação de ficha catalográfica a biblioteca as fichas são solicitadas pelo sistema: https://bicenficha.apps.uepg.br/login maiores esclarecimentos podem ligar –\xa03220-3383 ou enviar e-mail para\xa0processostecnicos@uepg.br que daremos as orientações. taxa de serviço,\xa0conforme resolução ca nº288 de 6 de agosto de 2012. catalogação na fonte/ficha catalográfica comunidade interna/uepg r$ 10,00 comunidade externa r$ 30,00 o valor deve ser pago por depósito bancário no banco caixa econômica federal – ag. 3186 – operação 003 c/c 118-5 em nome da fauepg. atenciosamente, eunice silva de novais diretora da biblioteca', 'horária: 45 créditos: 3 jurisdição civil e meios alternativos de prevenção e solução de conflitos de interesse carga horária: 45 créditos: 3 relações trabalhistas, ordem econômica e direito carga horária: 45 créditos: 3 meio ambiente do trabalho e sua proteção jurídica carga horária: 45 créditos: 3 disciplinas de aprofundamento específico relacionados à linha de pesquisa “teorias e práticas jurídicas na proteção de direitos fundamentais e na promoção de políticas públicas” controle de constitucionalidade e proteção de direitos fundamentais carga horária: 45 créditos: 3 direitos humanos, cidadania e inovação social - dinâmicas locais e globais carga horária: 45 créditos: 3 promoção de políticas públicas e judicialização carga horária: 45 créditos: 3 controle jurídico e social da administração pública carga horária: 45 créditos: 3 processo estrutural e judicialização de políticas públicas carga horária: 45 créditos: 3 direito digital, inteligência artificial e a otimização do acesso à justiça carga horária: 45 créditos: 3 disciplinas de conteúdo aberto (de formação geral ou aprofundamento específico): tópicos especiais em teorias e práticas jurídicas i carga horária: 45 créditos: 3 tópicos especiais em teorias e práticas jurídicas ii carga horária: 45 créditos: 3 disciplinas de orientação de dissertação de mestrado: todo(a)s a(o)s mestrandos, durante a integralização dos', '. o paradigma punitivo – sua afirmação e desconstrução. abolicionismo, perdão, descriminalização, negociação. a justiça restaurativa. perspectivas jurídicas e sociopolíticas. qualidade da democracia, cultura política e políticas criminais. populismo penal, direitos humanos e execução penal, em meio ao problema da ordem nos estabelecimentos penais. locus penitenciário como permanente estado de exceção. limites e possibilidades a partir do reconhecimento judicial do “estado de coisas inconstitucional”. (in)eficácia do controle da execução da pena pelo sistema de justiça. possibilidades de participação comunitária na execução da pena e no controle sobre sua execução. justiça e pós-modernidade: do panóptico ao monitoramento eletrônico – formas, tempos e lugares da punição. alternativas e proposições à “questão penitenciária”, em meio às contradições entre estrutura normativa, culturas político-jurídicas e práticas penitenciárias reais. processo penal e prática judiciária - aportes críticos ementa: o processo penal no contexto do sistema criminal e seus discursos: o lugar do processo penal brasileiro. os modelos históricos de sistemas processuais e o processo penal brasileiro pós constituição de 1988. os princípios e garantias constitucionais do processo penal brasileiro: o embate entre a dogmática e sua aplicação pelos tribunais superiores']","Sim, o aluno regular, desde que com a concordância do seu orientador, poderá cursar disciplina de aprofundamento específico – de outra linha de pesquisa –, em substituição a uma das 03 (três) disciplinas de formação geral.","Sim, admite-se o aproveitamento de disciplinas em formato presencial,",0.6666666666666666,0.6213460631015463,0.0,0.0
remoto ou híbrido.,"['. exame de qualificação nos termos do artigo 40 do regulamento do programa, o mestrando somente se submeterá a exame de qualificação após a conclusão dos créditos, aprovação em exame de suficiência em língua estrangeira, elaboração do projeto de dissertação ou trabalho final e apresentação de documento comprobatório de submissão e aceite de 01 (um) artigo para publicação em revista científica classificada no qualis/capes, ou em anais de qualificado evento técnico-científico, assim previamente reconhecido pelo colegiado do programa ou especificamente autorizado pelo orientador do mestrando. os requisitos para o cumprimento desta etapa constam no regulamento do programa. produto da pesquisa de acordo com o artigo 38 do regulamento do programa, o produto da pesquisa para o mestrado profissional poderá ser na forma de dissertação, trabalho final, ou ainda de acordo com a instrução normativa n°09/2025 no formato alternativo (modelo escandinavo) no âmbito do programa', 'em que foi publicado o artigo cópia do currículo lattes com o registro da atividade no local apropriado 40 (quarenta) horas por artigo e ilimitada a carga horária 3.17 publicação em periódico internacional qualis a2 30 (trinta) horas por artigo e ilimitada a carga horária 3.18 publicação em periódico internacional qualis b1 20 (vinte) horas por artigo até o limite de 60 (sessenta) horas 3.19 publicação em periódico internacional qualis b2 15 (quinze) horas por artigo até o limite de 60 (sessenta) horas 3.20 publicação em periódicos fora do país (sem qualis ou com qualis de menor pontuação) cópia do artigo completo, da capa do periódico, da ficha catalográfica completa e preferencialmente do sumário constando o artigo indicado cópia do currículo lattes com o registro da atividade no local apropriado 15 (quinze) horas por artigo até o limite de 60 (sessenta) horas', '. considerações do relator verificadas as avaliações realizadas pelo conselho técnico -científico da educação superior, concordo com os resultados sugeridos pela fundação coordenação de aperfeiçoamento de pessoal de nível superior (capes), relacionados no anexo 1 deste parecer, a serem publicados de forma integral pelo diário oficial da união (dou) , e apresento, à ces/cne, o voto favorável à sua homologação. ii – voto do relator acolho as recomendações da fundação coordenação de aperfeiçoamento de pessoal de nível superior (capes) e voto favoravelmente ao reconhecimento, com prazo de validade determinado pela sistemática avaliativa, dos cursos de mestrado e doutorado relacionados na planilha anexa ao presente parecer, aprovados pelo conselho técnico-científico da educação superior (ctc-es), na reunião realizada no período de 11 a 15 de maio de 2020 (194ª reunião). brasília (df), 17 de junho de 2020. conselheiro antonio de araujo freitas júnior – relator', '. c) projetos relacionados à linha de pesquisa “teorias e práticas jurídicas na proteção de direitos fundamentais e promoção de políticas públicas” transparência e acesso qualificado à informação: desafios para o controle jurídico e social da administração pública descrição: o “controle jurídico e social da administração pública” envolve três aspectos fundamentais: i) a forte impregnação constitucional, que se irradia para a integralidade do regime jurídico-administrativo, inclusive para os atos normativos decorrentes do exercício do poder regulamentar; ii) a consensualidade na tomada de decisões administrativas, que se prioriza em relação às decisões de autoridade que se fundamentam no exercício do poder de império; e, iii) a intensificação da presença de pessoas jurídicas de direito privado no espaço público, as quais passam a desempenhar funções originariamente pertencentes ao estado. essa nova administração pública, tida como democrática, justifica a necessidade de aprimoramento dos meios de controle, especialmente o social e da correspondente expansão dos mecanismos de participação', '. essa situação poderá ocorrer quando se avalie que a transversalidade exigida do mestrando possa, nas circunstâncias do tema que pesquise e dependendo da natureza e cronograma das disciplinas event ualmente', '. relações trabalhistas, ordem econômica e direito ementa: evolução histórica do direito do trabalho: da revolução industrial à sociedade pós-industrial. princípios e tendências do direito do trabalho na sociedade pós-industrial. teorias sobre a ordem econômica internacional, com foco nos direitos e deveres econômicos e sociais dos estados. globalização e multiplicação das empresas transnacionais em face da soberania dos estados. concepções sobre globalização e aplicação nos direitos sociais e coletivos. conflitos nas relações laborais e mecanismos de solução de controvérsias. as novas formas de trabalho e a necessidade de proteção. os impactos da reforma trabalhista nas relações de trabalho e na principiologia do direito do trabalho. meio ambiente do trabalho e sua proteção jurídica ementa: meio ambiente do trabalho como direito humano e fundamental. proteção à dignidade, saúde, higiene e segurança do trabalhador no ambiente laboral. responsabilidade social do empregador relacionada ao meio ambiente de trabalho salutar. projetos de ergonomia, saúde preventiva e equipamentos de proteção individual e coletiva, planos de saúde curativa; lazer e qualidade de vida do obreiro. instrumentos jurídicos de efetivação da tutela dos direitos metaindividuais do trabalhador', 'dê-se ciência e cumpra-se. ponta grossa, 03 de fevereiro de 2026. prof. dr. joão irineu de resende miranda coordenador', 'reitor. documento assinado eletronicamente por miguel sanches neto , reitor , em 21/10/2020, às 07:04, conforme art. 1º, iii, ""b"", da lei 11.419/2006. a autenticidade do documento pode ser conferida no site https://sei.uepg.br/autenticidade informando o código verificador 0328873 e o código crc 434671b4 . 19.000000268-4 0328873v 3 portaria r. 548 (0328873) sei 19.000000268-4 / pg. 2', 'prezados senhores: solicitamos a vossa senhoria, repassar as pós-graduações as informações abaixo, para confecção de ficha catalográfica. solicitação de ficha catalográfica a biblioteca as fichas são solicitadas pelo sistema: https://bicenficha.apps.uepg.br/login maiores esclarecimentos podem ligar –\xa03220-3383 ou enviar e-mail para\xa0processostecnicos@uepg.br que daremos as orientações. taxa de serviço,\xa0conforme resolução ca nº288 de 6 de agosto de 2012. catalogação na fonte/ficha catalográfica comunidade interna/uepg r$ 10,00 comunidade externa r$ 30,00 o valor deve ser pago por depósito bancário no banco caixa econômica federal – ag. 3186 – operação 003 c/c 118-5 em nome da fauepg. atenciosamente, eunice silva de novais diretora da biblioteca', '. art. 3 o durante o red, o discente ficará impedido de frequentar as disciplinas presenciais. art. 4o será atribuído, ao discente amparado pelo red, como compensação da ausência às aulas, exercícios domiciliares somente para aquelas disciplinas cujo acompanhamento seja compatível com as possibilidades da uepg. art. 5 o o discente amparado pelo red deverá submeter -se aos mesmos critérios de avaliação aplicados aos demais discentes.', '. art. 4º. não excederá de 2 (duas) disciplinas o total de disciplinas passíveis de aproveitamento por mestrando, realizadas em outro programa de pós-graduação, nas hipóteses especificadas nos artigos 2º e 3º. art. 5º. não serão aproveitadas, como disciplinas de formação geral, as disciplinas cursadas fora do programa de pós -graduação em direito da uepg. art. 6º. admite-se o aproveitamento de disciplinas em formato presencial, remoto ou híbrido. art. 7º. as autorizações para matrículas em disciplinas fora do programa de pós-graduação em direito da uepg dependem de prévia manifestação de seu colegiado, consoante artigos 10, x e 36 do regulamento do programa. art. 8º. consoante artigos 35 e 40 do regulamento do programa, somente poderão ser aproveitadas disciplinas cursadas no máximo até 2 (dois) anos antes da matrícula como aluno regular no curso, ou posteriormente à matrícula, neste caso antes do prazo de qualificação. ponta grossa, 1º de outubro de 2024. prof. eliezer gomes da silva coordenador do programa de pós-graduação em direito da uepg']","art. 6º. admite-se o aproveitamento de disciplinas em formato presencial, remoto ou híbrido.",nan,1.0,0.4638545451324587,0.0,0.14285714285714285
