user_input,retrieved_contexts,response,reference,faithfulness,answer_relevancy,context_precision,context_recall
Qual o email do mestrado?,"['anexo i da instrução normativa nº11/2025 pré-seleção de candidato ao mestrado profissional em direito da uepg vaga de fomento (entrar em contato com o email mestradodireitouepg@uepg.br para obter versão em docx) i - instituição parceira nome: cnpj: endereço (avenida/rua, número, cep e complemento, se houver): nome do representante institucional: unidade/órgão responsável pelo contato direto com a secretaria do mestrado: contato (e-mail e telefone): ii - dados do candidato pré-selecionado: nome: cpf: função ou qualificação na instituição parceira: endereço (avenida/rua, número, cep e complemento, se houver): contato (e-mail e telefone: iii - dados do estágio de imersão na instituição parceira unidade/órgão onde o estágio se realizará: nome do responsável: contato (e-mail e telefone) iv - dados do pré-projeto aprovado na instituição parceira título: professor orientador indicado: tema: problema da pesquisa (até 200 palavras):', '. art. 42 o título de mestre em direito será concedido ao discente que cumprir todas as exigências, a saber: i - concluir o número de créditos exigidos pelo programa;', 'prof. dr. ................ – (instituição) - suplente p.s: esse documento pode ser gerado no sei e assinado digitalmente pelos membros da banca.', 'instragram - https://www.instagram.com/mestradodireito.uepg/ publicações - https://www2.uepg.br/direito/category/mestrado/', '. segundo o mesmo relatório, o crescimento no número de demandas entre os anos de 2015 e 2016 foi de 5,6% e o número é alarmante em um país embriagado por uma cultura beligerante e pela judicialização de litígios. (cnj, 2017). no entanto, não é apenas pelos números que se tem ciência que o sistema de justiça brasileiro é lento e oneroso, o que leva os jurisdicionados à descrença e desconfiança na tutela de seus direitos. não obstante, para muitos, o poder judiciário ainda parece ser a única solução para os conflitos de interesses, como que houvesse um “fetiche pela toga”, diante da falsa ideia de que aquele é o detentor do monopólio da atividade destinada a solucionar conflitos, o que, reconhece-se, por um tempo, foi a única verdade. (leite; consalter, 2018). atento a isso, o cnj já se posicionou no sentido de incentivar as práticas e medidas que visem mitigar ou até alterar esse status, editando a resolução 125/2010 (cnj, 2010), que incentiva a pacificação de conflitos; e a resolução 225 que dispõe sobre a política nacional de justiça restaurativa no âmbito do poder judiciário (cnj, 2016). o poder judiciário também seguiu na mesma senda, tendo publicado o novo código de processo civil (brasil, 2015a), a lei de mediação (brasil, 2015b) e a lei de arbitragem (brasil, 2017), fazendo com que a legislação trilhe igual direção', '. essa situação poderá ocorrer quando se avalie que a transversalidade exigida do mestrando possa, nas circunstâncias do tema que pesquise e dependendo da natureza e cronograma das disciplinas event ualmente', 'processo nº: 23001.000483/2020-90 antonio freitas – 0483 5 (brasília) 19 educação 25001019084d0 u fpe universidade federal de pernambuco pe nordeste educação contemporânea do 4 20 engenharias iv 32020015012f9 cefet-mg centro federal de educação tecnológica de minas gerais mg sudeste automação e sistemas mp a 21 filosofia 22003010076m1 uece universidade estadual do ceará ce nordeste filosofia me a 22 história 42008018016r3 ucs universidade de caxias do sul rs sul história dp 4 23 história 31011012009r3 f gv/rj fundação getúlio vargas (rj) rj sudeste bens culturais e projetos sociais dp 5 24 interdisciplinar 15006018013m9 uepa universidade do estado do pará pa norte tecnologia, recursos naturais e sustentabilidade na amazônia me a 25 medicina i 3073015002f4 fap fundação antonio prudente hospital a.c.camargo sp sudeste cuidados oncológicos centrados no paciente mp a 26 odontologia 2051010007d3* med faculdade meridional rs sul odontologia do a unaerp universidade de ribeirão preto sp sudeste legenda: me - mestrado acadêmico do - doutorado acadêmico mp - mestrado profissional dp - doutorado profissional * forma associativa a - aprovado', '. parágrafo único. o red poderá ser requerido, também, por d iscente que tenha que servir de acompanhante a filho(a) com idade até 18 (dezoito) anos, em caso de internação por período superior a 08 (oito) dias. art. 7o quando os documentos comprobatórios do estado de saúde do discente forem fornecidos por médicos e stranhos aos quadros de serviço de saúde da uepg, deverão ser apresentados em forma de laudo onde constem todos os dados necessários e suficientes para a perfeita clareza e definição do seu estado de insanidade e, se for o caso, acompanhado dos exames complementares realizados.', '. art. 2o esta resolução entrará em vigor na data de sua publicação. reitoria da universidade estadual de ponta grossa. documento assinado eletronicamente por miguel sanches neto, reitor, em 22/12/2020, às 17:54, conforme art. 1º, iii, ""b"", da lei 11.419/2006. a autenticidade do documento pode ser conferida no site https://sei.uepg.br/autenticidade informando o código verificador 0382778 e o código crc 02e5358f. 19.000000268-4 0382778v2', '01/12/2020 sei/uepg - 0363290 - portaria r. https://sei.uepg.br/sei/controlador.php?acao=documento_visualizar&acao_origem=arvore_visualizar&id_documento=432108&infra_sistema=1000001… 2/2 criado por mamachado, versão 2 por mamachado em 30/11/2020 10:53:25.']",mestradodireito@uepg.br,O email de contato do mestrado é mestradodireitouepg@uepg.br.,1.0,0.722997978755413,0.7499999999625,1.0
Qual o contato para eu ligar para lá?,"['cadastro de participante externo (docente ou não) em atividades acadêmicas do ppgd nome completo rg cpf data de nascimento raça/cor pessoa com deficiência? e-mail orcid (se houver) instituição endereço residencial telefones para contato', 'prezados senhores: solicitamos a vossa senhoria, repassar as pós-graduações as informações abaixo, para confecção de ficha catalográfica. solicitação de ficha catalográfica a biblioteca as fichas são solicitadas pelo sistema: https://bicenficha.apps.uepg.br/login maiores esclarecimentos podem ligar –\xa03220-3383 ou enviar e-mail para\xa0processostecnicos@uepg.br que daremos as orientações. taxa de serviço,\xa0conforme resolução ca nº288 de 6 de agosto de 2012. catalogação na fonte/ficha catalográfica comunidade interna/uepg r$ 10,00 comunidade externa r$ 30,00 o valor deve ser pago por depósito bancário no banco caixa econômica federal – ag. 3186 – operação 003 c/c 118-5 em nome da fauepg. atenciosamente, eunice silva de novais diretora da biblioteca', '. o produto translacional deverá ser apresentado e descrito, com clara vinculação à dissertação. art. 7º. a introdução ampliada deverá conter entre 3 e 10 páginas, podendo conter subtópicos, incluindo o estado da arte, as justificativas e as hipóteses da pesquisa. art. 8º. os objetivos devem ser redigidos de forma direta e clara, contemplando o foco investigativo de cada artigo, sem necessidade de subdivisão entre objetivos gerais e específicos. art. 9º. o material e os métodos deverão apresentar informações suficientes para possibilitar a compreensão e a reprodutibilidade dos resultados, com ênfase na abordagem translacional. art. 10. a seção de artigos corresponderá aos resultados da dissertação. os artigos poderão estar em português, inglês ou espanhol, mas devem conter versão do resumo em português.', 'teorias e práticas jurídicas na proteção de direitos fundamentais e promoção de políticas públicas : tem como fundamento o levantamento e análise das experiências e fenômenos jurídicos concretos correlacionados à promoção de políticas públicas e proteção de direitos fundamentais com a finalidade de oportunizar a proposição de diagnósticos e mecanismos que contribuam para a redução dos conflitos sociais, bem como para a consolidação dos marcos constitucionais e de direito internacional relacionados ao controle da atividade estatal e ao asseguramento dos direitos e liberdades públicas inerentes à cidadania.', '. o poder judiciário também seguiu na mesma senda, tendo publicado o novo código de processo civil (brasil, 2015a), a lei de mediação (brasil, 2015b) e a lei de arbitragem (brasil, 2017), fazendo com que a legislação trilhe igual direção. e esse novo olhar para o sistema de justiça - menos beligerante, mais conciliador e transformador de conflitos - deverá ser empregado pelos advogados e demais profissionais do direito, sob pena de perderem o seu lugar no palco da vida onde os interesses são trilhados. nessa senda, ganham espaço os chamados “meios alternativos de solução de conflitos”, uma expressão derivada do inglês alternative dispute resolution (adr) e que “representa uma variedade de métodos de resolução de disputas de interesses, distintos e substitutivos da sentença proferida em um processo judicial” (alves da silva, 2012, p. 1-25), e a sua utilização “prescinde em uma quebra de preconceitos, e para a sua realização é necessário reconstruir o paradigma da justiça, acalmar animosidades, restabelecer a força decisória autônoma das partes, conferindo-lhes o poder que se perdeu durante a formação do conflito” (pereira; consalter, 2018, p. 24)', 'dê-se ciência e cumpra-se. ponta grossa, 03 de fevereiro de 2026. prof. dr. joão irineu de resende miranda coordenador', 'em que foi publicado o artigo cópia do currículo lattes com o registro da atividade no local apropriado 40 (quarenta) horas por artigo e ilimitada a carga horária 3.17 publicação em periódico internacional qualis a2 30 (trinta) horas por artigo e ilimitada a carga horária 3.18 publicação em periódico internacional qualis b1 20 (vinte) horas por artigo até o limite de 60 (sessenta) horas 3.19 publicação em periódico internacional qualis b2 15 (quinze) horas por artigo até o limite de 60 (sessenta) horas 3.20 publicação em periódicos fora do país (sem qualis ou com qualis de menor pontuação) cópia do artigo completo, da capa do periódico, da ficha catalográfica completa e preferencialmente do sumário constando o artigo indicado cópia do currículo lattes com o registro da atividade no local apropriado 15 (quinze) horas por artigo até o limite de 60 (sessenta) horas', '. parágrafo terceiro é vedado à(ao) discente a realização de atividades diversas daquelas elencadas no projeto de execução de estágio de imersão prático-institucional, documento que integra o presente instrumento, sem a anuência da unidade supervisora. parágrafo quarto a realização de estágio de imersão prático-institucional terá o acompanhamento do(a)', 'diário oficial da uniãoportaria nº 576, de 7 de julho de 2020 - portaria nº 576... http://www.in.gov.br/web/dou/-/portaria-n-576-de-7-de-julho-de-2020... 1 of 319/07/2020 22:11', '. concluindo os créditos e alcançando rendimento satisfatório, permanecerão matriculado(a)s em odm até a defesa de sua dissertação ou trabalho final. as odms estão regulamentadas na resolução n. 30/2016, do conselho de ensino, pesquisa e extensão (cepe), que deve ser compatibilizada com o regulamento do programa, cujo artigo 34, vi, prevê ""atividades de pesquisa e escrita acadêmica voltadas à dissertação ou trabalho final"", categoria em que se enquadram as odms.']",3220-3383,O número de contato é o Ramal (42)2102-8992 / 8993,1.0,,0.0,0.0
Quais são as disciplinas de formação geral?,"['. disciplinas disciplinas de formação geral: teorias da justiça carga horária: 45 créditos: 3 metodologia da pesquisa translacional no direito carga horária: 45 créditos: 3 teorias do direito carga horária: 45 créditos: 3 estado de direito e políticas públicas carga horária: 45 créditos: 3 disciplinas de aprofundamento específico: disciplinas de aprofundamento específico relacionados à linha de pesquisa “teorias e práticas jurídicas no sistema penal” sistema de justiça criminal à luz da criminologia carga horária: 45 créditos: 3 políticas criminais, direito e democracia carga horária: 45 créditos: 3 processo penal e prática judiciária – aportes críticos carga horária: 45 créditos: 3 violência intrafamiliar – políticas e práticas de prevenção e responsabilização carga horária: 45 créditos: 3 disciplinas de aprofundamento específico relacionados à linha de pesquisa “teorias e práticas jurídicas nas relações privadas e socioeconômicas” relações privadas, modernidade e direito carga horária: 45 créditos: 3 relações domésticas, familiares e afetivas e sua proteção jurídica carga horária: 45 créditos: 3 jurisdição civil e meios alternativos de prevenção e solução de conflitos de interesse carga horária: 45 créditos: 3 relações trabalhistas, ordem econômica e direito carga horária: 45 créditos: 3 meio ambiente do trabalho e sua proteção jurídica carga horária: 45 créditos: 3', '. art. 3 o durante o red, o discente ficará impedido de frequentar as disciplinas presenciais. art. 4o será atribuído, ao discente amparado pelo red, como compensação da ausência às aulas, exercícios domiciliares somente para aquelas disciplinas cujo acompanhamento seja compatível com as possibilidades da uepg. art. 5 o o discente amparado pelo red deverá submeter -se aos mesmos critérios de avaliação aplicados aos demais discentes.', 'específico, sendo 02 ( duas) da linha de pesquisa a que se vinculou e outras 02 (duas) de sua livre escolha; viii - o aluno regular, desde que com a concordância do seu orientador poderá cursar disciplina de aprofundamento específico – de outra linha de pesquisa –, em substituição a uma das 03 (três) disciplinas de formação geral', '. espera-se até mesmo que a coordenação e o colegiado do programa estimulem seus docentes a, de tempos em tempos, oferecerem tais disciplinas, evitando-se que levem anos e anos no programa ministrando sempre a mesma disciplina.', '. parágrafo único. para os alunos estrangeiros, o diploma de conclusão do curso de graduação, bem como todos seus documentos pessoais com tradução juramentada oficial e convalidados na embaixada brasileira no seu país de origem. título iv do corpo discente art. 1 6 o corpo discente do ppgd – mestrado profissional – área de concentração: teorias e práticas jurídicas em perspectiva translacional será constituído por alunos regulares e especiais.', 'prof. dr. ................ – (instituição) - suplente p.s: esse documento pode ser gerado no sei e assinado digitalmente pelos membros da banca.', 'justificativa (até 200 palavras): v - dados do produto a ser desenvolvido no mestrado tipo do produto aprovado pela instituição parceira, escolher somente 1, indicando o número: 1- curso de formação profissional (organização, criação ou realização de atividade docente de capacitação em diferentes níveis organizado e executado em parceria com o mestrado); 2- produto de editoração (organização de livro, coletânea sobre o tema no órgão em parceria com o programa, financiado pelo instituição parceira); 3- software/aplicativo (programa de computador, custos de desenvolvimeto pela instituição parceira); 4- norma ou marco regulatório (relativo a atividades internas ou regulatórias da instituição parceira); 5- relatório técnico conclusivo (em atendimento a demanda da instituição parceira); 6 - evento a ser organizado (parceria com o mestrado); 7- produto de comunicação (campanha de divulgação em atendimento a demanda da instituição parceira;) obs: a conclusão do curso do mestrado depende da implementação do produto.', 'anexo v formulário de enquadramento de atividades complementares (juntar um formulário antes da documentação comprobatória de cada atividade que pretende validar) nome do discente número do registro acadêmico nome do professor-orientador linha pesquisa de vinculação do discente semestre/ano de ingresso do discente no programa item da tabela nome da atividade realizada descrição da participação específica do discente na atividade (indicando dados do respectivo documento comprobatório) período e local de realização pretensão da quantidade de carga horária nos termos da tabela de atividades complementares ponta grossa, data. discente', 'diário oficial da uniãoportaria nº 576, de 7 de julho de 2020 - portaria nº 576... http://www.in.gov.br/web/dou/-/portaria-n-576-de-7-de-julho-de-2020... 1 of 319/07/2020 22:11', 'prezados senhores: solicitamos a vossa senhoria, repassar as pós-graduações as informações abaixo, para confecção de ficha catalográfica. solicitação de ficha catalográfica a biblioteca as fichas são solicitadas pelo sistema: https://bicenficha.apps.uepg.br/login maiores esclarecimentos podem ligar –\xa03220-3383 ou enviar e-mail para\xa0processostecnicos@uepg.br que daremos as orientações. taxa de serviço,\xa0conforme resolução ca nº288 de 6 de agosto de 2012. catalogação na fonte/ficha catalográfica comunidade interna/uepg r$ 10,00 comunidade externa r$ 30,00 o valor deve ser pago por depósito bancário no banco caixa econômica federal – ag. 3186 – operação 003 c/c 118-5 em nome da fauepg. atenciosamente, eunice silva de novais diretora da biblioteca']","Teorias da justiça, metodologia da pesquisa translacional no direito, teorias do direito, estado de direito e políticas públicas, disciplinas de aprofundamento específico relacionadas à linha de pesquisa “teorias e práticas jurídicas no sistema penal”, sistema de justiça criminal à luz da criminologia, políticas criminais, direito e democracia, processo penal e prática judiciária – aportes críticos, violência intrafamiliar – políticas e práticas de prevenção e responsabilização.","Teorias da Justiça, ""Metodologia da pesquisa translacional no Direito"", ""Teorias do Direito e Estado de Direito e Políticas Públicas"".",1.0,0.5095348542010014,0.9999999999,1.0
