user_input,retrieved_contexts,response,reference,faithfulness,answer_relevancy,context_precision,context_recall
"meses, com a possibilidade de prorrogação, por até 6 (seis) meses, desde que","['. art. 42 o título de mestre em direito será concedido ao discente que cumprir todas as exigências, a saber: i - concluir o número de créditos exigidos pelo programa;', '. essa situação poderá ocorrer quando se avalie que a transversalidade exigida do mestrando possa, nas circunstâncias do tema que pesquise e dependendo da natureza e cronograma das disciplinas event ualmente', 'prezados senhores: solicitamos a vossa senhoria, repassar as pós-graduações as informações abaixo, para confecção de ficha catalográfica. solicitação de ficha catalográfica a biblioteca as fichas são solicitadas pelo sistema: https://bicenficha.apps.uepg.br/login maiores esclarecimentos podem ligar –\xa03220-3383 ou enviar e-mail para\xa0processostecnicos@uepg.br que daremos as orientações. taxa de serviço,\xa0conforme resolução ca nº288 de 6 de agosto de 2012. catalogação na fonte/ficha catalográfica comunidade interna/uepg r$ 10,00 comunidade externa r$ 30,00 o valor deve ser pago por depósito bancário no banco caixa econômica federal – ag. 3186 – operação 003 c/c 118-5 em nome da fauepg. atenciosamente, eunice silva de novais diretora da biblioteca', 'dê-se ciência e cumpra-se. ponta grossa, 03 de fevereiro de 2026. prof. dr. joão irineu de resende miranda coordenador', '. crime e cultura parecem desempenhar um papel fundamental e sua interligação merece ser desvelada para inspirar ou aperfeiçoar eficazes políticas públicas e práticas jurídicas voltadas à prevenção ou à redução dessa peculiar forma de violência. daí a importância das complementares formações acadêmicas e experiências profissionais da equipe de professores que integram o projeto, bem como a articulação com consolidado projeto de extensão desenvolvido pela uepg, o numape (núcleo maria da penha). nesse horizonte analítico, o esforço de pesquisa, em enfoque sociojurídico interdisciplinar, se dará a partir de uma profunda investigação sobre dados da realidade da violência de gênero registrados nos sistemas de justiça e de saúde pública; da busca por instrumentos e soluções criadas em outros sistemas jurídico-políticos, em forma planos, estratégias e ações vislumbradas com o enfoque preventivo, rompendo a tradição meramente reativa das políticas voltadas a enfrentar a questão. enfim, o projeto levantará os esforços de diferentes agências e instituições públicas e privadas, acadêmicas, sanitárias, jurídicas, da sociedade civil, registrando as vozes e argumentos das vítimas e ativistas de direitos humanos, analisando protocolos de prevenção etc. pretende não apenas apresentar dados da realidade, mas formular proposições para voltadas a positivamente transformá-la', 'anexo da resolução cepe no 043, de 21 de agosto de 2018. fl. 2 de 6 parágrafo único. será facultado ao discente solicitar a revogação do seu red, mediante apresentação de atestado médico ou odontológico que comprove ter o mesmo, plenas condições de retorno às suas atividades acadêmicas. capítulo ii dos discentes com afecções congênitas ou adquiridas, infecções, traumatismo ou outras condições mórbidas, determinando distúrbios agudos ou agudizados art. 6o são considerados merecedores de tratamento excepcional, com direito à inserção no red, os discentes com afecções congênitas ou adquiridas, infecções, traumatismo ou outras condições mórbidas, determinando distúrbios agudos ou agudizados, caracterizados por: i - incapacidade física relativa, incompatível com a frequência das atividades acadêmicas desde que se verifique a conservação das condições intelectuais e emocionais necessárias para o prosseguimento de suas atividades; ii - ocorrência isolada ou esporádica; iii - duração que não ultrapasse o máximo ainda admissível, em cada caso, para a continuidade do processo pedagógico de aprendizado, atendendo a que tais características se verificam, entre outros, em casos de síndromes hemorrágicas (tais como a hemofilia), asma, car dite, pericardites, afecções osteoarticulares submetidas a correções ortopédicas, nefropatias agudas ou subagudas, afecções reumáticas etc. parágrafo único', 'diário oficial da uniãoportaria nº 576, de 7 de julho de 2020 - portaria nº 576... http://www.in.gov.br/web/dou/-/portaria-n-576-de-7-de-julho-de-2020... 1 of 319/07/2020 22:11', '. considerações do relator verificadas as avaliações realizadas pelo conselho técnico -científico da educação superior, concordo com os resultados sugeridos pela fundação coordenação de aperfeiçoamento de pessoal de nível superior (capes), relacionados no anexo 1 deste parecer, a serem publicados de forma integral pelo diário oficial da união (dou) , e apresento, à ces/cne, o voto favorável à sua homologação. ii – voto do relator acolho as recomendações da fundação coordenação de aperfeiçoamento de pessoal de nível superior (capes) e voto favoravelmente ao reconhecimento, com prazo de validade determinado pela sistemática avaliativa, dos cursos de mestrado e doutorado relacionados na planilha anexa ao presente parecer, aprovados pelo conselho técnico-científico da educação superior (ctc-es), na reunião realizada no período de 11 a 15 de maio de 2020 (194ª reunião). brasília (df), 17 de junho de 2020. conselheiro antonio de araujo freitas júnior – relator', 'setor de ciências jurídicas programa de pós-graduação em direito mestrado profissional anexo vii formulário de consolidação e conferência das atividades complementares que pretende validar n. do item na tabela do anexo i descrição sumária pontuação almejada p/mestrando(a) pontuação atribuída (item a ser preenchido pelo colegiado) observações (item a ser preenchido pelo colgiado) …………............ ……………………………………………………………... ………………..... ………………………………...... ………………………………….. …………............ ……………………………………………………………... ………………..... ……………………………… ………………………………….. …………............ ……………………………………………………………... ………………..... ……………………………… ………………………………….. somatória de pontuação ………………..... ……………………………… ………………………………......', 'em que foi publicado o artigo cópia do currículo lattes com o registro da atividade no local apropriado 40 (quarenta) horas por artigo e ilimitada a carga horária 3.17 publicação em periódico internacional qualis a2 30 (trinta) horas por artigo e ilimitada a carga horária 3.18 publicação em periódico internacional qualis b1 20 (vinte) horas por artigo até o limite de 60 (sessenta) horas 3.19 publicação em periódico internacional qualis b2 15 (quinze) horas por artigo até o limite de 60 (sessenta) horas 3.20 publicação em periódicos fora do país (sem qualis ou com qualis de menor pontuação) cópia do artigo completo, da capa do periódico, da ficha catalográfica completa e preferencialmente do sumário constando o artigo indicado cópia do currículo lattes com o registro da atividade no local apropriado 15 (quinze) horas por artigo até o limite de 60 (sessenta) horas']","Desculpe, não tenho informações suficientes para responder a essa pergunta.",nan,0.0,0.0,0.0,0.0
justificado pelo orientador e aprovado pelo Colegiado do Programa.,"['desde que haja a aprovação do colegiado do programa; xv - cada orientador poderá ter até 02 (dois) orientandos no primeiro ciclo avaliativo do programa, número que nos ciclos posteriores, ou por razões excepcionais, justificadas pelo colegiado do programa, poderá chegar até 04 (quatro) orientandos simultaneamente', 'justificativa (até 200 palavras): v - dados do produto a ser desenvolvido no mestrado tipo do produto aprovado pela instituição parceira, escolher somente 1, indicando o número: 1- curso de formação profissional (organização, criação ou realização de atividade docente de capacitação em diferentes níveis organizado e executado em parceria com o mestrado); 2- produto de editoração (organização de livro, coletânea sobre o tema no órgão em parceria com o programa, financiado pelo instituição parceira); 3- software/aplicativo (programa de computador, custos de desenvolvimeto pela instituição parceira); 4- norma ou marco regulatório (relativo a atividades internas ou regulatórias da instituição parceira); 5- relatório técnico conclusivo (em atendimento a demanda da instituição parceira); 6 - evento a ser organizado (parceria com o mestrado); 7- produto de comunicação (campanha de divulgação em atendimento a demanda da instituição parceira;) obs: a conclusão do curso do mestrado depende da implementação do produto.', 'específico, sendo 02 ( duas) da linha de pesquisa a que se vinculou e outras 02 (duas) de sua livre escolha; viii - o aluno regular, desde que com a concordância do seu orientador poderá cursar disciplina de aprofundamento específico – de outra linha de pesquisa –, em substituição a uma das 03 (três) disciplinas de formação geral', '. estado de direito e políticas públicas ementas: as origens do estado. o poder do estado. formação e justificação do estado: teoria das formas de estado. estado social e democrático de direito. estado de bem-estar social e reformas políticas. estado e ideologia. estado e poder. estado e sociedade. limitação do poder do estado. estado federativo e políticas públicas. estado federativo e descentralização de políticas públicas. as relações de poder entre os entes federativos. o autoritarismo no estado brasileiro e suas implicações no desenho das políticas públicas. estado na américa latina e suas transformações. práticas governamentais, práticas sociopolíticas e o papel do direito, entre os fundamentos normativos e as condições empíricas do estado democrático de direito, em meio às demandas e contingências complexas e plurais das sociedades contemporâneas. solução negociada de conflitos cíveis, criminais e de interesse da administração pública ementa: o campo jurídico entre o conflito e consenso, nos campos cível, penal e de interesse da administração pública. limites éticos e jurídicos à negociação. pragmatismo e justiça. meios extrajudiciais e judiciais de composição de litígios. sistemas autocompositivos (conciliação, mediação e negociação) e heterocompositivos (jurisdição e arbitragem). horizontes, limites e desafios para uma justiça “restaurativa”', '. § 2º - caso a assinatura da coordenação do mestrado profissional represente a ciencia e/ou anuencia desta com a proposiçao de projeto de pesquisa (como, por exemplo, ética em pesquisa em seres humanos) o projeto deverá instruir a solicitação de assinatura. art. 3º as assinaturas serão realizadas de acordo com as dinâmicas das atividades administrativas da coordenação, em harmonia com as demais atividades relativas à docência do coordenador e/ou vice-coordenador. recomenda-se que, na eventualidade de prazo final para a apresentação da proposta que necessite ser assinada pela coordenação, que seja observada uma semana de antecedência ao prazo final do envio da referida proposta.', '. problemas ocorridos e resultados obtidos também devem compor este campo. 6 conclusões e recomendações propositivas demonstrar a perspectiva translacional das atividades desenvolvidas, destacando os pontos fundamentais e relevantes do período de imersão, bem como o oferecimento de elementos sugestivos de contribuição para minimizar os problemas práticos eventualmente encontrados, bem como aprimoramento das relações sociojurídicaspresentes no ambiente pesquisado. 7 referências bibliográficas 8 anexos (se houver) ponta grossa, data. discente professor(a)-orientador(a) representante da unidade supervisora', '. essa nova administração pública, tida como democrática, justifica a necessidade de aprimoramento dos meios de controle, especialmente o social e da correspondente expansão dos mecanismos de participação. a pesquisa proposta, para além de explicitar os principais obstáculos que impedem um eficaz manejo dos dados públicos, buscará delimitar de que forma o controle jurídico da administração pública poderá ser utilizado para garantir o aperfeiçoamento de seu controle social, o qual, uma vez assegurado, também instrumentalizaria, numa relação de reciprocidade, o controle jurídico. resgatando as duas conhecidas dimensões de “accountability”, a vertical (representada pelas cobranças políticas dos cidadãos em face dos seus governantes, tanto no plano individual, no exercício do voto, quanto no plano das reivindicações coletivas) e a horizontal (representada pelo papel que exercem agências estatais de controle, como controladorias, tribunais de conta, corregedorias, ministério público), a pesquisa estudará de que forma essas instâncias horizontais de controle têm contribuído para o eficaz exercício do controle social', '. art. 3 o durante o red, o discente ficará impedido de frequentar as disciplinas presenciais. art. 4o será atribuído, ao discente amparado pelo red, como compensação da ausência às aulas, exercícios domiciliares somente para aquelas disciplinas cujo acompanhamento seja compatível com as possibilidades da uepg. art. 5 o o discente amparado pelo red deverá submeter -se aos mesmos critérios de avaliação aplicados aos demais discentes.', 'em que foi publicado o artigo cópia do currículo lattes com o registro da atividade no local apropriado 40 (quarenta) horas por artigo e ilimitada a carga horária 3.17 publicação em periódico internacional qualis a2 30 (trinta) horas por artigo e ilimitada a carga horária 3.18 publicação em periódico internacional qualis b1 20 (vinte) horas por artigo até o limite de 60 (sessenta) horas 3.19 publicação em periódico internacional qualis b2 15 (quinze) horas por artigo até o limite de 60 (sessenta) horas 3.20 publicação em periódicos fora do país (sem qualis ou com qualis de menor pontuação) cópia do artigo completo, da capa do periódico, da ficha catalográfica completa e preferencialmente do sumário constando o artigo indicado cópia do currículo lattes com o registro da atividade no local apropriado 15 (quinze) horas por artigo até o limite de 60 (sessenta) horas', '. art. 20 no caso de discente adotante ou que obtiver a guarda judicial para fins de adoção de criança, o pedido deverá ser instruído com o termo judicial de guarda ou documento comprobatório de adoção. art. 21 o atestado médico ou odontológico deverá especificar as data s de início e término do período em que o discente ficará afastado das atividades acadêmicas, contendo dados legíveis, e tendo a assinatura e o carimbo com o número de registro no conselho regional respectivo do profissional emissor. parágrafo único . serão indeferidos os pedidos protocolizados com déficit de documentos comprobatórios e/ou em desacordo com os prazos estabelecidos neste regulamento. art. 22 a propesp reserva-se o direito de efetuar a conferência da veracidade dos atestados médicos e odontol ógicos apresentados, mediante confirmação junto ao próprio profissional responsável pela emissão.']","Desculpe, não tenho informações suficientes para responder a essa pergunta.",nan,0.5,0.0,0.0,0.96
"Em relação as vagas de fomento, gostaria de saber até quando essas vagas podem ser ofertadas.","['. 3º. até o mês de agosto de cada ano letivo o coordenador, em reunião do colegiado, relatará o interesse das instituições requerentes por vagas de fomento, bem como a anuência destes pedidos com os requisitos presentes nesta instrução normativa. com base neste relato o colegiado autorizará as vaga de fomento para cada instituição requerente, por ocasião do planejamento do processo seletivo. parágrafo ùnico - para que a vaga fomento seja aprovada pelo colegiado a instituição requerente deverá cumprir com os seguintes requisitos: a) resposta tempestiva sobre o interesse em ter vaga de fomento até a data estipulada no ofício de consulta à instituição enviado pela coordenação do mestrado; b) apresentação do anexo i da presente instrução normativa preenchido, com a indicação do (s) respectivo candidato; c) autorização para que a instituição seja campo de estágio de imersão técnica e institucional para os candidatos da vaga fomento e também para acadêmicos do mestrado profissional em direito; d) apresentação de contrapartida ao mestrado e ao professor orientador no interesse da realização do desenvolvimento do projeto de pesquisa tais como pagamento de publicações ou acesso a revista acadêmica da instituição,patrocínio de eventos acadêmicos, auxílio a participação em eventos ou cursos acadêmicos ou', 'prezados senhores: solicitamos a vossa senhoria, repassar as pós-graduações as informações abaixo, para confecção de ficha catalográfica. solicitação de ficha catalográfica a biblioteca as fichas são solicitadas pelo sistema: https://bicenficha.apps.uepg.br/login maiores esclarecimentos podem ligar –\xa03220-3383 ou enviar e-mail para\xa0processostecnicos@uepg.br que daremos as orientações. taxa de serviço,\xa0conforme resolução ca nº288 de 6 de agosto de 2012. catalogação na fonte/ficha catalográfica comunidade interna/uepg r$ 10,00 comunidade externa r$ 30,00 o valor deve ser pago por depósito bancário no banco caixa econômica federal – ag. 3186 – operação 003 c/c 118-5 em nome da fauepg. atenciosamente, eunice silva de novais diretora da biblioteca', '. essa situação poderá ocorrer quando se avalie que a transversalidade exigida do mestrando possa, nas circunstâncias do tema que pesquise e dependendo da natureza e cronograma das disciplinas event ualmente', 'específico): tópicos especiais em teorias e práticas jurídicas i carga horária: 45 créditos: 3 tópicos especiais em teorias e práticas jurídicas ii carga horária: 45 créditos: 3 disciplinas de orientação de dissertação de mestrado: todo(a)s a(o)s mestrandos, durante a integralização dos créditos, se obrigam a se inscrever nas disciplinas ""orientação de dissertação de mestrado i"" (odm-i) e ""orientação de dissertação de mestrado ii"" (odm-ii)', 'dê-se ciência e cumpra-se. ponta grossa, 03 de fevereiro de 2026. prof. dr. joão irineu de resende miranda coordenador', 'diário oficial da uniãoportaria nº 576, de 7 de julho de 2020 - portaria nº 576... http://www.in.gov.br/web/dou/-/portaria-n-576-de-7-de-julho-de-2020... 1 of 319/07/2020 22:11', 'cadastro de participante externo (docente ou não) em atividades acadêmicas do ppgd nome completo rg cpf data de nascimento raça/cor pessoa com deficiência? e-mail orcid (se houver) instituição endereço residencial telefones para contato', '. com efeito, o escritório das nações unidas para as drogas e crimes (unodoc, em inglês) divulgou uma publicação, em novembro de 2018 – gender-related killing of women and girls, parte da futura publicação global study on homicide 2019 – com a conclusão de que “em todo o mundo, em países ricos e pobres, em regiões desenvolvidas ou em desenvolvimento, um total de 50.000 mulheres por ano são mortas por seus parceiros atuais ou pretéritos, por pais, irmãos, mães, irmãs e outros membros da família tão somente por conta do papel e status das vítimas como mulheres” (unocod, 2018, p. 58, nossa tradução). esses números representam, de acordo com esse mesmo estudo, 58% das 87.000 mulheres dolosamente mortas em 2017, por seus parceiros íntimos ou por membros da família. portanto, se a violência contra a mulher (no limite, o feminicídio) não é apenas um fenômeno global persistente e crescente, independentemente do aparato jurídico, da estrutura e funcionamento do sistema de justiça criminal de cada país, suas taxas médias de criminalidade para os crimes em geral, ou sua consolidada cultura de paz ou violência, a violência contra a mulher (particularmente a intrafamiliar) revela-se um tópico de pesquisa mais do que desafiador, porque gira em torno do direito, mas ultrapassa os seus horizontes', '. essa infraestrutura ampliada, no âmbito da própria uepg, e numa área da cidade de fácil deslocamento urbano e acesso rodoviário, com diversos hotéis e restaurantes no entorno e próxima das sedes da oab e de instituições do sistema de justiça, contribuirá para dinamizar as atividades do programa e sua interação com outros públicos acadêmicos e profissionais na área do direito. nesta página serão atualizadas informações sobre a evolução do projeto de implantação física do ceppodi em suas novas instalações.', '. relações trabalhistas, ordem econômica e direito ementa: evolução histórica do direito do trabalho: da revolução industrial à sociedade pós-industrial. princípios e tendências do direito do trabalho na sociedade pós-industrial. teorias sobre a ordem econômica internacional, com foco nos direitos e deveres econômicos e sociais dos estados. globalização e multiplicação das empresas transnacionais em face da soberania dos estados. concepções sobre globalização e aplicação nos direitos sociais e coletivos. conflitos nas relações laborais e mecanismos de solução de controvérsias. as novas formas de trabalho e a necessidade de proteção. os impactos da reforma trabalhista nas relações de trabalho e na principiologia do direito do trabalho. meio ambiente do trabalho e sua proteção jurídica ementa: meio ambiente do trabalho como direito humano e fundamental. proteção à dignidade, saúde, higiene e segurança do trabalhador no ambiente laboral. responsabilidade social do empregador relacionada ao meio ambiente de trabalho salutar. projetos de ergonomia, saúde preventiva e equipamentos de proteção individual e coletiva, planos de saúde curativa; lazer e qualidade de vida do obreiro. instrumentos jurídicos de efetivação da tutela dos direitos metaindividuais do trabalhador']",até o mês de agosto de cada ano letivo,"Até o mês de Agosto de cada ano letivo o Coordenador, em reunião do",1.0,0.6750064628262744,0.6666666666333333,1.0
